{
  "arcp_schema_version": "0.2",
  "component_type": "llm_provider_profile",
  "component_id": "local-no-structured-output",
  "component_version": "0.1.0",
  "protocol_version": "0.2",
  "name": "Local Provider Without Structured Output",
  "description": "Local provider that lacks structured output support.",
  "provider": {
    "capabilities": ["llm.completion"],
    "supports_structured_output": false,
    "supports_tool_calling": true,
    "supports_streaming": true,
    "context_window": 16000,
    "quality_tier": "low"
  },
  "incompatibilities": []
}
