{
  "arcp_schema_version": "0.2",
  "component_type": "llm_provider_profile",
  "component_id": "local-openai-compatible",
  "component_version": "0.1.0",
  "protocol_version": "0.2",
  "name": "Local OpenAI-Compatible Provider",
  "description": "Local provider with basic capabilities.",
  "provider": {
    "capabilities": ["llm.completion"],
    "supports_structured_output": true,
    "supports_tool_calling": true,
    "supports_streaming": true,
    "context_window": 32000,
    "quality_tier": "medium"
  },
  "incompatibilities": []
}
