{
  "arcp_schema_version": "0.2",
  "component_type": "beta",
  "component_id": "workbench_beta",
  "component_version": "0.1.0",
  "protocol_version": "0.2",
  "name": "Workbench Beta (No Actionable Review)",
  "description": "Beta variant that lacks actionable review support.",
  "supports": {
    "harness": ">=1.3.8,<1.4.0"
  },
  "contracts": {
    "agent_manifest": "1.0"
  },
  "capabilities": {
    "provides": ["llm.completion"]
  },
  "human_review": {
    "schema_version": "0.5",
    "supported_actions": []
  },
  "events": {
    "supported_types": []
  }
}
